{"$schema":"https://json-schema.org/draft/2020-12/schema","type":"object","additionalProperties":false,"required":["$schema","schemaVersion","viewports","inputCapabilities","constraints"],"$defs":{"identifier":{"type":"string","pattern":"^[a-z][a-z0-9-]*(?![\\s\\S])"},"inputCapability":{"enum":["touch","pointer","keyboard","voice","switch"]},"nonBlankText":{"type":"string","minLength":1,"pattern":"[^\\u0000-\\u0020\\u007F-\\u00A0\\u00AD\\u034F\\u061C\\u115F\\u1160\\u1680\\u17B4\\u17B5\\u180B-\\u180F\\u2000-\\u200F\\u2028-\\u202F\\u205F-\\u206F\\u2800\\u3000\\u3164\\uFE00-\\uFE0F\\uFEFF\\uFFA0\\uFFF0-\\uFFFF𓑁𓑂𝅙]"}},"properties":{"$schema":{"const":"../schemas/viewports.schema.json"},"schemaVersion":{"const":1},"viewports":{"type":"array","minItems":1,"items":{"type":"object","additionalProperties":false,"required":["id","minWidthPx","description"],"properties":{"id":{"$ref":"#/$defs/identifier"},"minWidthPx":{"type":"integer","minimum": 0},"description":{"$ref":"#/$defs/nonBlankText"}}}},"inputCapabilities":{"type":"array","minItems":1,"uniqueItems":true,"contains":{"const":"keyboard"},"items":{"$ref":"#/$defs/inputCapability"}},"constraints":{"type":"object","additionalProperties":false,"required":["zoomSupported","horizontalScrolling","orientationIndependent"],"properties":{"zoomSupported":{"const":true},"horizontalScrolling":{"enum":["never","content-specific"]},"orientationIndependent":{"const":true}}}}}
